type,slug,original_title,title_tag,meta_description,pillar
guide,how-to-build-a-keyword-strategy-for-your-industry-that-attracts-the-right-clients,"How to build a keyword strategy for your industry that attracts the right clients","How to build a keyword strateg — Expert Guide | TBC","Transactional keywords ('book a financial consultant Delhi') attract people ready to engage. Learn how to resolve this and scale effectively. TBC, NCR.",P6
guide,how-to-set-up-google-analytics-and-search-console-to-understand-your-website-traffic,"How to set up Google Analytics and Search Console to understand your website traffic","How to set up Google Analytics — Expert Guide | TBC","), bounce rate by page (which pages are failing to engage visitors? Learn how to resolve this and scale effectively. TBC, Greater Noida.",P6
guide,how-to-build-a-linkedin-company-page-that-generates-business-enquiries,"How to build a LinkedIn company page that generates business enquiries","How to build a LinkedIn compan — Expert Guide | TBC","Done incorrectly, it wastes time. Learn how to resolve this and scale effectively. TBC, NCR.",P6
guide,how-to-use-whatsapp-business-for-client-communication-without-losing-professionalism,"How to use WhatsApp Business for client communication without losing professionalism","How to use WhatsApp Business f — Expert Guide | TBC","Managing WhatsApp professionally, at scale, requires systems that most companies don't have. Learn how to resolve this and scale effectively. TBC, NCR.",P6
guide,how-to-run-instagram-and-facebook-for-a-b2b-company-without-wasting-time,"How to run Instagram and Facebook for a B2B company without wasting time","How to run Instagram and Faceb — Expert Guide | TBC","LinkedIn and Google are where your buyers are. Learn how to resolve this and scale effectively. TBC, Greater Noida.",P6
guide,how-to-use-video-content-to-build-your-brand-without-a-production-budget,"How to use video content to build your brand without a production budget","How to use video content to bu — Expert Guide | TBC","Founders who wait until they can produce 'proper' videos produce nothing. Learn how to resolve this and scale effectively. TBC, Delhi NCR.",P6
guide,how-to-manage-your-company-s-online-reputation,"How to manage your company's online reputation","How to manage your company's o — Expert Guide | TBC","Struggling with manage your company's online r? Learn how to overcome this challenge and scale your operations successfully. TBC, Greater Noida.",P6
guide,how-to-build-a-brand-identity-for-your-company-that-s-not-just-a-logo,"How to build a brand identity for your company that's not just a logo","How to build a brand identity for — BRAND BUILDING | TBC","Most Indian SMEs treat brand as a logo and some colours. Learn how to resolve this and scale effectively. TBC, Delhi NCR.",P7
guide,how-to-create-a-brand-style-guide-your-team-will-actually-use,"How to create a brand style guide your team will actually use","How to create a brand style guide — BRAND BUILDING | TBC","A brand style guide documents the rules for how your brand is expressed visually and verbally. Learn how to resolve this and scale effectively. TBC, NCR.",P3
guide,how-to-brief-a-designer-or-agency-so-you-get-what-you-actually-want,"How to brief a designer or agency so you get what you actually want","How to brief a designer or agency — BRAND BUILDING | TBC","), the audience (who will see it and what do they need to feel? Learn how to resolve this and scale effectively. TBC, NCR.",P2
guide,how-to-develop-a-messaging-framework-for-your-company,"How to develop a messaging framework for your company","How to develop a messaging — BRAND BUILDING | TBC","'  Test your messaging with real clients. Learn how to master develop a messaging framework for your company to drive growth. TBC, Greater Noida.",P2
guide,how-to-get-press-coverage-for-your-company-without-a-pr-agency,"How to get press coverage for your company without a PR agency","How to get press coverage for your — PR & MEDIA | TBC","Journalists are looking for news, not promotion. Learn how to resolve this and scale effectively. TBC, Delhi NCR.",P7
guide,how-to-write-a-press-release-that-journalists-will-actually-read,"How to write a press release that journalists will actually read","How to write a press release that — PR & MEDIA | TBC","Struggling with write a press release that jou? Learn how to overcome this challenge and scale your operations successfully. TBC, Delhi NCR.",P7
guide,how-to-position-your-founder-as-a-thought-leader-in-your-industry,"How to position your founder as a thought leader in your industry","How to position your founder as a — PR & MEDIA | TBC","The foundation is genuine expertise expressed publicly. Learn how to resolve this and scale effectively. TBC, NCR.",P4
guide,how-to-handle-a-pr-crisis-or-negative-press-coverage,"How to handle a PR crisis or negative press coverage","How to handle a PR crisis or — PR & MEDIA | TBC","Struggling with handle a pr crisis or negative? Learn how to overcome this challenge and scale your operations successfully. TBC, Delhi NCR.",P2
guide,how-to-make-business-events-and-conferences-worth-the-time-and-money,"How to make business events and conferences worth the time and money","How to make business events and — EVENTS & NETWORKING | TBC","Most events publish an attendee or speaker list. Learn how to resolve this and scale effectively. TBC, NCR.",P2
guide,how-to-host-a-client-event-that-builds-relationships-and-generates-referrals,"How to host a client event that builds relationships and generates referrals","How to host a client event that — EVENTS & NETWORKING | TBC","The purpose determines the format, the guest list, and the content. Learn how to resolve this and scale effectively. TBC, Greater Noida.",P2
guide,how-to-speak-at-industry-conferences-and-use-it-to-generate-business,"How to speak at industry conferences and use it to generate business","How to speak at industry — EVENTS & NETWORKING | TBC","The difference is whether attendees come to learn about you or to solve their own problem. Learn how to resolve this and scale effectively. TBC, Delhi NCR.",P7
guide,how-to-build-a-professional-network-that-actually-helps-your-business,"How to build a professional network that actually helps your business","How to build a professional ne — Expert Guide | TBC","The reciprocity is real but not immediate; build the account before you draw on it. Learn how to resolve this and scale effectively. TBC, NCR.",P2
guide,how-to-identify-and-approach-potential-business-partners,"How to identify and approach potential business partners","How to identify and approach — Expert Guide | TBC","Struggling with identify and approach potentia? Learn how to overcome this challenge and scale your operations successfully. TBC, Greater Noida.",P2
guide,how-to-structure-a-channel-partner-or-reseller-programme,"How to structure a channel partner or reseller programme","How to structure a channel par — Expert Guide | TBC","Done well, it multiplies your distribution significantly. Learn how to master structure a channel partner or reseller programme to drive growth. TBC, NCR.",P3
guide,how-to-manage-a-joint-venture-with-another-indian-company,"How to manage a joint venture with another Indian company","How to manage a joint venture — Expert Guide | TBC","Before structuring a JV, be honest about the alternative. Learn how to resolve this and scale effectively. TBC, NCR.",P7
guide,how-to-co-market-with-a-complementary-business-to-reach-new-clients,"How to co-market with a complementary business to reach new clients","How to co-market with a — PARTNERSHIPS & ALLIANCES | TBC","Start with one specific initiative rather than a broad co-marketing agreement. Learn how to resolve this and scale effectively. TBC, Delhi NCR.",P7
guide,how-to-evaluate-whether-a-strategic-partnership-is-worth-pursuing,"How to evaluate whether a strategic partnership is worth pursuing","How to evaluate whether a stra — Expert Guide | TBC","Not every partnership opportunity deserves your time. Learn how to resolve this and scale effectively. TBC, Delhi NCR.",P2
guide,how-to-run-linkedin-ads-for-b2b-lead-generation-in-india,"How to run LinkedIn Ads for B2B lead generation in India","How to run LinkedIn Ads for B2B — DIGITAL ADVERTISING | TBC","Struggling with run linkedin ads for b2b lead ? Learn how to overcome this challenge and scale your operations successfully. TBC, NCR.",P6
guide,how-to-use-email-marketing-to-nurture-b2b-leads-without-spamming-people,"How to use email marketing to nurture B2B leads without spamming people","How to use email marketing to — DIGITAL ADVERTISING | TBC","The distinction is between email that serves the reader and email that serves the sender. Learn how to resolve this and scale effectively. TBC, Delhi NCR.",P1
guide,how-to-measure-whether-your-marketing-is-actually-generating-business,"How to measure whether your marketing is actually generating business","How to measure whether your — DIGITAL ADVERTISING | TBC","Marketing spend without measurement is hope, not strategy. Learn how to resolve this and scale effectively. TBC, Delhi NCR.",P6
guide,how-to-create-a-lead-magnet-that-attracts-your-ideal-b2b-client,"How to create a lead magnet that attracts your ideal B2B client","How to create a lead magnet that — DIGITAL MARKETING | TBC","These convert because they're immediately useful, not because they're comprehensive. Learn how to resolve this and scale effectively. TBC, Greater Noida.",P6
guide,how-to-build-a-sales-funnel-for-a-b2b-service-company,"How to build a sales funnel for a B2B service company","How to build a sales funnel for a — DIGITAL MARKETING | TBC","They don't close deals — they start conversations. Learn how to master build a sales funnel for a b2b service company to drive growth. TBC, NCR.",P6
guide,how-to-set-up-a-referral-tracking-system-so-you-can-thank-and-reward-referrers,"How to set up a referral tracking system so you can thank and reward referrers","How to set up a referral tracking — DIGITAL MARKETING | TBC","A referral tracking system converts accidental referrals into a managed programme. Learn how to resolve this and scale effectively. TBC, Greater Noida.",P6
guide,how-to-differentiate-your-company-when-you-re-in-a-crowded-market,"How to differentiate your company when you're in a crowded market","How to differentiate your company — BRAND BUILDING | TBC","Real differentiation is specific, provable, and valued by your ideal client. Learn how to resolve this and scale effectively. TBC, NCR.",P2
guide,how-to-build-a-company-culture-that-becomes-a-competitive-advantage,"How to build a company culture that becomes a competitive advantage","How to build a company culture that — BRAND BUILDING | TBC","How do we treat each other when things are difficult? Learn how to resolve this and scale effectively. TBC, NCR.",P3
guide,how-to-manage-your-company-s-brand-across-multiple-channels-consistently,"How to manage your company's brand across multiple channels consistently","How to manage your company's brand — BRAND BUILDING | TBC","Inconsistency signals a lack of organisational discipline that sophisticated clients notice. Learn how to resolve this and scale effectively. TBC, NCR.",P2
guide,how-to-use-case-studies-to-generate-new-business,"How to use case studies to generate new business","How to use case studies to generate — PR & MEDIA | TBC","Struggling with use case studies to generate n? Learn how to overcome this challenge and scale your operations successfully. TBC, Greater Noida.",P2
guide,how-to-use-awards-and-rankings-to-build-credibility,"How to use awards and rankings to build credibility","How to use awards and rankings to — PR & MEDIA | TBC","Identify the credible awards in your industry and geography. Learn how to master use awards and rankings to build credibility to drive growth. TBC, NCR.",P7
guide,how-to-build-a-speaker-profile-and-apply-for-conference-talks,"How to build a speaker profile and apply for conference talks","How to build a speaker profile and — PR & MEDIA | TBC","Struggling with build a speaker profile and ap? Learn how to overcome this challenge and scale your operations successfully. TBC, Greater Noida.",P2
guide,how-to-run-a-webinar-that-generates-genuine-leads,"How to run a webinar that generates genuine leads","How to run a webinar that gene — Expert Guide | TBC","Topic selection determines registrant quality. Learn how to master run a webinar that generates genuine leads to drive growth. TBC, NCR.",P2
guide,how-to-network-effectively-in-online-communities-and-forums,"How to network effectively in online communities and forums","How to network effectively in — EVENTS & NETWORKING | TBC","Generic 'entrepreneur' communities are full of people selling to each other. Learn how to resolve this and scale effectively. TBC, Greater Noida.",P7
guide,how-to-build-a-partner-ecosystem-around-your-product-or-service,"How to build a partner ecosystem around your product or service","How to build a partner ecosyst — Expert Guide | TBC","Build around a common client problem. Learn how to resolve this and scale effectively. TBC, Delhi NCR.",P2
guide,how-to-create-a-franchise-or-licensing-model-from-your-existing-business,"How to create a franchise or licensing model from your existing business","How to create a franchise or — Expert Guide | TBC","Many franchise models fail because the economics only work for the franchisor. Learn how to resolve this and scale effectively. TBC, Greater Noida.",P2
guide,how-to-use-whatsapp-broadcast-lists-for-b2b-marketing-without-annoying-people,"How to use WhatsApp broadcast lists for B2B marketing without annoying people","How to use WhatsApp broadcast — Expert Guide | TBC","Segment your broadcast lists carefully. Learn how to resolve this and scale effectively. TBC, Greater Noida.",P6
guide,how-to-build-a-podcast-or-audio-content-strategy-for-your-business,"How to build a podcast or audio content strategy for your business","How to build a podcast or audio — DIGITAL MARKETING | TBC","Podcasts are the fastest-growing content channel for professional audiences in India. Learn how to resolve this and scale effectively. TBC, Delhi NCR.",P6
guide,how-to-manage-your-digital-marketing-when-you-can-t-afford-a-dedicated-team,"How to manage your digital marketing when you can't afford a dedicated team","How to manage your digital — DIGITAL MARKETING | TBC","For companies under 50 people, a dedicated digital marketing team is often not justified. Learn how to resolve this and scale effectively. TBC, Delhi NCR.",P3
guide,how-to-protect-your-brand-and-domain-name-online,"How to protect your brand and domain name online","How to protect your brand and — DIGITAL MARKETING | TBC","Your brand exists online before you formally claim it. Learn how to master protect your brand and domain name online to drive growth. TBC, Delhi NCR.",P1
guide,how-to-create-a-company-newsletter-that-people-actually-read,"How to create a company newsletter that people actually read","How to create a company newsle — Expert Guide | TBC","If it takes more than 4 minutes to read, it won't be read. Learn how to resolve this and scale effectively. TBC, Delhi NCR.",P2
guide,how-to-plan-an-annual-marketing-calendar-for-a-b2b-company,"How to plan an annual marketing calendar for a B2B company","How to plan an annual marketing — EVENTS & NETWORKING | TBC","Struggling with plan an annual marketing calen? Learn how to overcome this challenge and scale your operations successfully. TBC, Delhi NCR.",P6
guide,how-to-build-a-marketing-team-as-your-company-grows,"How to build a marketing team as your company grows","How to build a marketing team as — EVENTS & NETWORKING | TBC","Struggling with build a marketing team as your? Learn how to overcome this challenge and scale your operations successfully. TBC, NCR.",P3
guide,how-to-comply-with-esop-regulations-under-indian-company-law,"How to comply with ESOP regulations under Indian company law","How to comply with ESOP regula — Expert Guide | TBC","This is an often-overlooked benefit of ESOP programmes. Learn how to resolve this and scale effectively. TBC, NCR.",P7
guide,how-to-explain-esops-to-your-employees-so-they-understand-and-value-them,"How to explain ESOPs to your employees so they understand and value them","How to explain ESOPs to your — Expert Guide | TBC","The most common ESOP failure is not the design — it's the communication. Learn how to resolve this and scale effectively. TBC, NCR.",P1
guide,how-to-handle-esops-when-an-employee-leaves,"How to handle ESOPs when an employee leaves","How to handle ESOPs when an — Expert Guide | TBC","Struggling with handle esops when an employee ? Learn how to overcome this challenge and scale your operations successfully. TBC, Delhi NCR.",P2
guide,how-to-set-up-pf-and-esic-correctly-when-you-cross-the-threshold,"How to set up PF and ESIC correctly when you cross the threshold","How to set up PF and ESIC corr — Expert Guide | TBC","Missing these deadlines attracts interest and penalties. Learn how to resolve this and scale effectively. TBC, Delhi NCR.",P3
guide,how-to-handle-pf-for-employees-who-earn-above-the-threshold,"How to handle PF for employees who earn above the threshold","How to handle PF for employees — Expert Guide | TBC","PF compliance for higher-earning employees is more nuanced than many Indian companies realise. Learn how to resolve this and scale effectively. TBC, NCR.",P3
guide,how-to-manage-esic-claims-and-ensure-your-employees-can-access-benefits,"How to manage ESIC claims and ensure your employees can access benefits","How to manage ESIC claims and — Expert Guide | TBC","This card is required to access ESIC medical facilities and claim benefits. Learn how to resolve this and scale effectively. TBC, NCR.",P1
guide,how-to-manage-pf-compliance-during-employee-transfers-and-restructuring,"How to manage PF compliance during employee transfers and restructuring","How to manage PF compliance du — Expert Guide | TBC","Struggling with manage pf compliance during em? Learn how to overcome this challenge and scale your operations successfully. TBC, Delhi NCR.",P2
guide,how-to-stay-compliant-with-labour-laws-as-your-headcount-grows,"How to stay compliant with labour laws as your headcount grows","How to stay compliant with lab — Expert Guide | TBC","Indian labour law compliance changes as your headcount crosses certain thresholds. Learn how to resolve this and scale effectively. TBC, Delhi NCR.",P7
guide,how-to-draft-employment-contracts-that-protect-your-company,"How to draft employment contracts that protect your company","How to draft employment contra — Expert Guide | TBC","Struggling with draft employment contracts tha? Learn how to overcome this challenge and scale your operations successfully. TBC, NCR.",P2
guide,how-to-conduct-a-retrenchment-or-layoff-in-compliance-with-indian-labour-law,"How to conduct a retrenchment or layoff in compliance with Indian labour law","How to conduct a retrenchment — Expert Guide | TBC","Struggling with conduct a retrenchment or layo? Learn how to overcome this challenge and scale your operations successfully. TBC, Greater Noida.",P7
guide,how-to-manage-contract-labour-in-compliance-with-the-contract-labour-act,"How to manage contract labour in compliance with the Contract Labour Act","How to manage contract labour — Expert Guide | TBC","The registration is obtained from the state labour department. Learn how to resolve this and scale effectively. TBC, Delhi NCR.",P7
guide,how-to-handle-sexual-harassment-complaints-under-the-posh-act,"How to handle sexual harassment complaints under the POSH Act","How to handle sexual harassmen — Expert Guide | TBC","The presiding officer must be a senior female employee. Learn how to resolve this and scale effectively. TBC, Delhi NCR.",P1
guide,how-to-build-a-grievance-redressal-mechanism-your-employees-will-actually-use,"How to build a grievance redressal mechanism your employees will actually use","How to build a grievance redre — Expert Guide | TBC","The mechanism only works if employees believe it's safe to use. Learn how to resolve this and scale effectively. TBC, Greater Noida.",P2
guide,how-to-set-up-a-payroll-system-for-a-50-person-company,"How to set up a payroll system for a 50-person company","How to set up a payroll system — Expert Guide | TBC","Struggling with set up a payroll system for a ? Learn how to overcome this challenge and scale your operations successfully. TBC, NCR.",P4
guide,how-to-structure-ctc-to-minimise-employee-tax-liability-legally,"How to structure CTC to minimise employee tax liability legally","How to structure CTC to minimise — PAYROLL MANAGEMENT | TBC","HRA should be a meaningful component of CTC for employees who rent. Learn how to resolve this and scale effectively. TBC, NCR.",P3
guide,how-to-handle-salary-increments-and-promotions-fairly-and-consistently,"How to handle salary increments and promotions fairly and consistently","How to handle salary increment — Expert Guide | TBC","This conversation turns a financial transaction into a development conversation. Learn how to resolve this and scale effectively. TBC, Greater Noida.",P1
guide,how-to-manage-payroll-for-employees-in-multiple-states,"How to manage payroll for employees in multiple states","How to manage payroll for empl — Expert Guide | TBC","Struggling with manage payroll for employees i? Learn how to overcome this challenge and scale your operations successfully. TBC, Greater Noida.",P4
guide,how-to-process-full-and-final-settlement-correctly-when-an-employee-leaves,"How to process Full and Final Settlement correctly when an employee leaves","How to process Full and Final — PAYROLL MANAGEMENT | TBC","Getting this wrong creates disputes, delayed EPFO transfers, and occasionally legal claims. Learn how to resolve this and scale effectively. TBC, NCR.",P2
guide,how-to-decide-whether-to-hire-an-employee-or-engage-a-contractor,"How to decide whether to hire an employee or engage a contractor","How to decide whether to hire — Expert Guide | TBC","Most companies default to one or the other without consciously evaluating the trade-offs. Learn how to resolve this and scale effectively. TBC, NCR.",P2
guide,how-to-draft-a-contractor-agreement-that-protects-your-company,"How to draft a contractor agreement that protects your company","How to draft a contractor agre — Expert Guide | TBC","These elements make the relationship look like employment. Learn how to resolve this and scale effectively. TBC, Greater Noida.",P2
guide,how-to-manage-a-team-of-freelancers-and-remote-contractors-effectively,"How to manage a team of freelancers and remote contractors effectively","How to manage a team of freela — Expert Guide | TBC","Onboarding matters even for short engagements. Learn how to resolve this and scale effectively. TBC, Greater Noida.",P3
guide,how-to-convert-a-long-term-contractor-to-a-full-time-employee,"How to convert a long-term contractor to a full-time employee","How to convert a long-term — CONTRACTOR VS EMPLOYEE | TBC","The financial conversion is often the complexity. Learn how to resolve this and scale effectively. TBC, Delhi NCR.",P2
guide,how-to-design-a-leave-policy-that-balances-employee-needs-and-business-continuity,"How to design a leave policy that balances employee needs and business continuity","How to design a leave policy that — LEAVE & BENEFITS | TBC","A clear, fair, and consistently applied leave policy reduces HR overhead significantly. Learn how to resolve this and scale effectively. TBC, NCR.",P7
guide,how-to-manage-maternity-leave-compliantly-and-supportively,"How to manage maternity leave compliantly and supportively","How to manage maternity leave — LEAVE & BENEFITS | TBC","Struggling with manage maternity leave complia? Learn how to overcome this challenge and scale your operations successfully. TBC, Greater Noida.",P7
guide,how-to-build-an-onboarding-process-that-gets-new-employees-productive-faster,"How to build an onboarding process that gets new employees productive faster","How to build an onboarding pro — Expert Guide | TBC","Struggling with build an onboarding process th? Learn how to overcome this challenge and scale your operations successfully. TBC, Greater Noida.",P2
guide,how-to-conduct-exit-interviews-that-give-you-useful-information,"How to conduct exit interviews that give you useful information","How to conduct exit interviews — Expert Guide | TBC","One person saying 'the manager was difficult' may be a personality clash. Learn how to resolve this and scale effectively. TBC, NCR.",P2
guide,how-to-build-an-hr-dashboard-that-gives-you-real-visibility-into-your-workforce,"How to build an HR dashboard that gives you real visibility into your workforce","How to build an HR dashboard t — Expert Guide | TBC","Most Indian founders who ask 'how is our team doing? Learn how to resolve this and scale effectively. TBC, Greater Noida.",P2
guide,how-to-run-a-salary-benchmarking-exercise-for-your-industry,"How to run a salary benchmarking exercise for your industry","How to run a salary benchmarki — Expert Guide | TBC","Define your benchmarking peer group carefully. Learn how to resolve this and scale effectively. TBC, NCR.",P2
guide,how-to-implement-a-360-degree-feedback-process-that-actually-improves-performance,"How to implement a 360-degree feedback process that actually improves performance","How to implement a 360-degree — HR SYSTEMS & PROCESSES | TBC","Reviewers who don't work closely with the employee produce uninformed feedback. Learn how to resolve this and scale effectively. TBC, Greater Noida.",P2
