type,slug,original_title,title_tag,meta_description,pillar
blog,ai-vendor-problem-businesses-buying-wrong-things,"The AI Vendor Problem: Why Most Businesses Are Buying the Wrong Things","The AI Vendor Problem: Why Most — AI Strategy | TBC","Struggling with most businesses are buying the? Learn how to overcome this challenge and scale your operations successfully. TBC, NCR.",P1
blog,meeting-should-have-been-email-email-should-not-exist,"The Meeting That Should Have Been an Email — And the Email That Should Not Have Existed","The Meeting That Should Have Been — Operations | TBC","A one-hour meeting of six people costs six person-hours, not one. Learn how to resolve this and scale effectively. TBC, Greater Noida.",P1
blog,ai-healthcare-wellness-businesses-opportunity-constraint,"AI in Healthcare and Wellness Businesses: The Opportunity and the Constraint","AI in Healthcare and Wellness — AI | TBC","Struggling with the opportunity and the constr? Learn how to overcome this challenge and scale your operations successfully. TBC, Greater Noida.",P1
blog,when-to-pivot-when-to-persist-business-decision,"When to Pivot and When to Persist: A Framework for the Hardest Business Decision","When to Pivot and When to Persist: — Strategy | TBC","Struggling with a framework for the hardest bu? Learn how to overcome this challenge and scale your operations successfully. TBC, NCR.",P2
blog,ai-real-estate-property-management-what-works,"AI in Real Estate and Property Management: What Actually Works","AI in Real Estate and Property — AI Strategy | TBC","Maintenance management is a second strong operational opportunity. Learn how to master what actually works to drive growth. TBC, Delhi NCR.",P1
blog,handoff-problem-work-gets-lost-between-people-teams,"The Handoff Problem: Why Work Gets Lost Between People and Teams","The Handoff Problem: Why Work Gets — Operations | TBC","Handoffs fail for three consistent reasons. Learn how to master work gets lost between people and teams to drive growth. TBC, NCR.",P2
blog,future-of-work-not-jobless-taskless,"The Future of Work Is Not Jobless — It Is Taskless","The Future of Work Is Not — Jobless — It Is Taskless | TBC","This design is not technically difficult. Learn how to resolve this and scale effectively. TBC, Delhi NCR.",P1
blog,feedback-changes-behaviour-practical-guide-leaders,"Feedback That Changes Behaviour: A Practical Guide for Leaders","Feedback That Changes Behaviour: A — Leadership | TBC","Struggling with a practical guide for leaders? Learn how to overcome this challenge and scale your operations successfully. TBC, Greater Noida.",P4
blog,ai-education-training-businesses-personalisation-scale,"AI for Education and Training Businesses: Personalisation at Scale","AI for Education and Training — AI | TBC","But personalisation is expensive to deliver at scale. Learn how to master personalisation at scale to drive growth. TBC, NCR.",P1
blog,pricing-strategy-service-businesses-mistakes,"Pricing Strategy for Service Businesses: The Mistakes That Cost the Most","Pricing Strategy for Service — Strategy | TBC","Struggling with the mistakes that cost the mos? Learn how to overcome this challenge and scale your operations successfully. TBC, Delhi NCR.",P5
blog,building-first-ai-system-non-technical-leaders,"Building Your First AI System: A Step-by-Step Guide for Non-Technical Leaders","Building Your First AI System: A — AI | TBC","Struggling with a step-by-step guide for non-t? Learn how to overcome this challenge and scale your operations successfully. TBC, Delhi NCR.",P1
blog,supply-chain-visibility-ai-whole-picture,"Supply Chain Visibility: What AI Adds When You Can Finally See the Whole Picture","Supply Chain Visibility: What AI — Operations | TBC","Most supply chain failures are fundamentally information failures. Learn how to resolve this and scale effectively. TBC, Greater Noida.",P1
blog,accountability-deficit-organisations-cannot-create,"The Accountability Deficit: Why Organisations Talk About It and Cannot Create It","The Accountability Deficit: Why — Leadership | TBC","Struggling with organisations talk about it an? Learn how to overcome this challenge and scale your operations successfully. TBC, NCR.",P3
blog,measuring-ai-roi-investment-working,"Measuring AI ROI: How to Know Whether Your AI Investment Is Working","Measuring AI ROI: How to Know — AI Strategy | TBC","A second challenge is attribution. Learn how to master know whether your ai investment is working to drive growth. TBC, Greater Noida.",P1
blog,founder-to-ceo-identity-shift-determines-whether-you-scale,"From Founder to CEO: The Identity Shift That Determines Whether You Scale","From Founder to CEO: The Identity — Strategy | TBC","The founder's value to the business is inseparable from their personal output. Learn how to resolve this and scale effectively. TBC, Greater Noida.",P4
blog,building-ai-into-new-products-what-best-product-teams-do-differently,"Building AI Into New Products: What the Best Product Teams Do Differently","Building AI Into New Products: What — AI | TBC","Struggling with what the best product teams do? Learn how to overcome this challenge and scale your operations successfully. TBC, NCR.",P1
blog,hidden-bottleneck-slowest-process-sets-pace-everything,"The Hidden Bottleneck: Why Your Slowest Process Is Setting the Pace for Everything","The Hidden Bottleneck: Why Your — Operations | TBC","Only improving the bottleneck does. Learn how to resolve this and scale effectively. TBC, Delhi NCR.",P2
blog,next-five-years-ai-business-what-to-expect-how-to-prepare,"The Next Five Years of AI in Business: What to Expect and How to Prepare","The Next Five Years of AI in — AI Strategy | TBC","Predicting the future of AI with precision is not possible. Learn how to master what to expect and prepare to drive growth. TBC, Greater Noida.",P1
blog,consulting-relationship-how-to-be-good-client,"The Consulting Relationship That Actually Works: How to Be a Good Client","The Consulting Relationship That — Consulting | TBC","Struggling with be a good client? Learn how to overcome this challenge and scale your operations successfully. TBC, Delhi NCR.",P2
blog,ai-b2b-sales-what-changes-when-intelligence-enters-sales-process,"AI for B2B Sales: What Changes When Intelligence Enters the Sales Process","AI for B2B Sales: What Changes When — AI | TBC","Beyond preparation, AI adds value in the sales process in several specific ways. Learn how to resolve this and scale effectively. TBC, Delhi NCR.",P1
blog,performance-review-that-changes-something,"The Performance Review That Changes Something","The Performance Review — That Changes Something | TBC","A second design failure is the annual cadence. Learn how to master the performance review that changes something to drive growth. TBC, NCR.",P4
blog,starting-ai-journey-practical-roadmap-businesses-beginning,"Starting Your AI Journey: A Practical Roadmap for Businesses at the Beginning","Starting Your AI Journey: A — AI Strategy | TBC","The problem might be that new hires take too long to become productive. Learn how to resolve this and scale effectively. TBC, Greater Noida.",P1
blog,building-systems-outlast-individuals-operational-legacy-good-leadership,"Building Systems That Outlast Individuals: The Operational Legacy of Good Leadership","Building Systems That Outlast — Operations | TBC","Struggling with the operational legacy of good? Learn how to overcome this challenge and scale your operations successfully. TBC, Greater Noida.",P2
blog,ai-manufacturing-where-intelligence-creates-leverage,"AI for Manufacturing: Where Intelligence Creates the Most Leverage","AI for Manufacturing: Where — AI Strategy | TBC","Struggling with where intelligence creates the? Learn how to overcome this challenge and scale your operations successfully. TBC, Greater Noida.",P1
blog,executive-time-management-protecting-hours-that-matter,"Executive Time Management: Protecting the Hours That Actually Matter","Executive Time Management: — Leadership | TBC","Struggling with protecting the hours that actu? Learn how to overcome this challenge and scale your operations successfully. TBC, Delhi NCR.",P4
blog,retrieval-augmented-generation-rag-business-ai,"What Is Retrieval-Augmented Generation — And Why It Matters for Business AI","What Is Retrieval-Augmented — AI | TBC","The answer to that question is Retrieval-Augmented Generation, or RAG. Learn how to resolve this and scale effectively. TBC, Delhi NCR.",P1
blog,why-good-processes-break-under-growth-redesign-for-next-scale,"Why Good Processes Break Under Growth — And How to Redesign for the Next Scale","Why Good Processes Break Under — Operations | TBC","It fails as the team grows and information fragments across functions and individuals. Learn how to resolve this and scale effectively. TBC, NCR.",P2
blog,ai-hype-cycle-where-indian-businesses-actually-are,"The AI Hype Cycle and Where Indian Businesses Actually Are","The AI Hype Cycle and Where Indian — AI Strategy | TBC","Struggling with the ai hype cycle and where in? Learn how to overcome this challenge and scale your operations successfully. TBC, Greater Noida.",P1
blog,what-management-consultant-actually-does-tuesday,"What a Management Consultant Actually Does on a Tuesday","What a Management Consultant — Consulting | TBC","Management consulting has an image problem, and the image is mostly its own fault. Learn how to resolve this and scale effectively. TBC, Delhi NCR.",P4
blog,ai-automation-what-should-be-automated-what-should-not,"AI and Automation: Understanding What Should Be Automated and What Should Not","AI and Automation: Understanding — AI | TBC","Third: what would stop if this automation failed? Learn how to resolve this and scale effectively. TBC, NCR.",P1
blog,team-meeting-that-actually-works,"The Team Meeting That Actually Works","The Team Meeting — That Actually Works | TBC","Struggling with the team meeting that actually? Learn how to overcome this challenge and scale your operations successfully. TBC, Greater Noida.",P3
blog,turbo-bytes-consulting-how-we-think-about-ai-strategy,"Turbo Bytes Consulting: How We Think About AI Strategy","Turbo Bytes Consulting: How We — AI Strategy | TBC","Often it is both, applied in sequence. Learn how to master how we think about ai strategy to drive growth. TBC, NCR.",P1
blog,cost-of-complexity-how-businesses-accumulate-what-they-cannot-afford,"The Cost of Complexity: How Businesses Accumulate What They Cannot Afford","The Cost of Complexity: How — Operations | TBC","But the indirect cost is often larger. Learn how to master how businesses accumulate what they cannot afford to drive growth. TBC, NCR.",P2
blog,intelligence-advantage-how-smart-businesses-use-information-to-win,"The Intelligence Advantage: How Smart Businesses Use Information to Win","The Intelligence Advantage: How — AI Strategy | TBC","Struggling with how smart businesses use infor? Learn how to overcome this challenge and scale your operations successfully. TBC, Greater Noida.",P1
blog,resilient-organisation-build-business-survives-disruption,"The Resilient Organisation: How to Build a Business That Survives Disruption","The Resilient Organisation: How to — Leadership | TBC","Struggling with build a business that survives? Learn how to overcome this challenge and scale your operations successfully. TBC, Delhi NCR.",P3
blog,ai-implementation-mistakes-organisations-make-twice,"AI Implementation Mistakes That Organisations Make Twice","AI Implementation Mistakes That — AI | TBC","AI implementation failures are more consistent than they appear. Learn how to resolve this and scale effectively. TBC, Delhi NCR.",P1
blog,growing-revenue-without-growing-headcount-leverage-question,"Growing Revenue Without Growing Headcount: The Leverage Question","Growing Revenue Without Growing — Strategy | TBC","Struggling with the leverage question? Learn how to overcome this challenge and scale your operations successfully. TBC, Delhi NCR.",P5
blog,ai-retail-what-indian-retailers-can-deploy-today,"AI in Retail: What Indian Retailers Can Deploy Today","AI in Retail — What Indian Retailers Can Deploy Today | TBC","Struggling with what indian retailers can depl? Learn how to overcome this challenge and scale your operations successfully. TBC, Delhi NCR.",P1
blog,lead-team-through-uncertainty-without-pretending-answers,"How to Lead a Team Through Uncertainty Without Pretending You Have the Answers","How to Lead a Team Through — Leadership | TBC","Struggling with lead a team through uncertaint? Learn how to overcome this challenge and scale your operations successfully. TBC, Greater Noida.",P1
blog,difference-ai-pilots-ai-programmes-why-it-matters,"The Difference Between AI Pilots and AI Programmes — And Why It Matters","The Difference Between AI Pilots — AI Strategy | TBC","It is the organisational pattern in which pilots succeed and then nothing happens. Learn how to resolve this and scale effectively. TBC, Delhi NCR.",P1
blog,decision-fatigue-growing-businesses-leaders-get-worse-busier,"Decision Fatigue in Growing Businesses: Why Leaders Get Worse as They Get Busier","Decision Fatigue in Growing — Operations | TBC","Struggling with leaders get worse as they get ? Learn how to overcome this challenge and scale your operations successfully. TBC, NCR.",P2
blog,custom-ai-vs-off-the-shelf-making-right-choice,"Custom AI vs Off-the-Shelf: Making the Right Choice for Your Business","Custom AI vs Off-the-Shelf: Making — AI | TBC","Struggling with making the right choice for yo? Learn how to overcome this challenge and scale your operations successfully. TBC, Greater Noida.",P1
blog,board-management-founder-led-businesses-what-changes,"Board Management for Founder-Led Businesses: What Changes When You Have One","Board Management for Founder-Led — Leadership | TBC","The ones who learn to engage it effectively find it valuable. Learn how to master what changes when you have one to drive growth. TBC, Greater Noida.",P4
blog,ai-talent-question-hire-or-build-capability,"The AI Talent Question: Do You Need to Hire or Can You Build Capability?","The AI Talent Question: Do You Need — AI Strategy | TBC","Struggling with do you need to hire or can you? Learn how to overcome this challenge and scale your operations successfully. TBC, Greater Noida.",P1
blog,reporting-revolution-data-dumps-to-decision-support,"The Reporting Revolution: From Data Dumps to Decision Support","The Reporting Revolution: From Data — Operations | TBC","Struggling with from data dumps to decision su? Learn how to overcome this challenge and scale your operations successfully. TBC, Greater Noida.",P2
blog,language-of-ai-key-terms-business-leaders-should-understand,"The Language of AI: Key Terms Every Business Leader Should Actually Understand","The Language of AI: Key Terms Every — AI | TBC","What follows is not a comprehensive glossary. Learn how to resolve this and scale effectively. TBC, Greater Noida.",P1
blog,exit-preparation-founder-thinks-about-too-late,"The Exit Preparation No Founder Thinks About Until It Is Too Late","The Exit Preparation No Founder — Strategy | TBC","These are not urgent problems. Learn how to resolve this and scale effectively. TBC, NCR.",P4
blog,ai-hr-people-operations-where-intelligence-helps,"AI for HR and People Operations: Where Intelligence Helps and Where It Should Not Go","AI for HR and People Operations: — AI | TBC","The applications that deliver value are specific and accessible. Learn how to resolve this and scale effectively. TBC, Delhi NCR.",P1
blog,art-of-saying-no-senior-leaders-protect-strategic-focus,"The Art of Saying No: How Senior Leaders Protect Strategic Focus","The Art of Saying No: How Senior — Leadership | TBC","Struggling with how senior leaders protect str? Learn how to overcome this challenge and scale your operations successfully. TBC, Greater Noida.",P4
blog,compound-effect-ai-advantage-grows-over-time,"The Compound Effect of AI: Why the Advantage Grows Over Time","The Compound Effect of AI: Why the — AI Strategy | TBC","Struggling with the advantage grows over time? Learn how to overcome this challenge and scale your operations successfully. TBC, NCR.",P1
guide,how-to-implement-5s-in-your-factory-without-it-becoming-a-one-time-exercise,"How to implement 5S in your factory without it becoming a one-time exercise","How to implement 5S in your fa — Expert Guide | TBC","The problem is Sustain — the fifth S that determines whether the other four stick. Learn how to resolve this and scale effectively. TBC, NCR.",P2
guide,how-to-reduce-production-downtime-without-expensive-equipment-upgrades,"How to reduce production downtime without expensive equipment upgrades","How to reduce production downt — Expert Guide | TBC","PM is not glamorous but it prevents the failures that cause 4-hour shutdowns. Learn how to resolve this and scale effectively. TBC, Greater Noida.",P2
guide,how-to-negotiate-a-commercial-lease-without-overpaying,"How to negotiate a commercial lease without overpaying","How to negotiate a commercial — Expert Guide | TBC","Struggling with negotiate a commercial lease w? Learn how to overcome this challenge and scale your operations successfully. TBC, NCR.",P7
guide,how-to-get-your-company-website-to-rank-on-google-without-hiring-an-seo-agency,"How to get your company website to rank on Google without hiring an SEO agency","How to get your company websit — Expert Guide | TBC","Google ranks pages that best answer a specific search query. Learn how to resolve this and scale effectively. TBC, NCR.",P6
guide,how-to-design-an-esop-plan-that-actually-retains-your-best-people,"How to design an ESOP plan that actually retains your best people","How to design an ESOP plan tha — Expert Guide | TBC","Struggling with design an esop plan that actua? Learn how to overcome this challenge and scale your operations successfully. TBC, NCR.",P1
guide,how-to-hire-your-first-hr-manager-without-overpaying,"How to hire your first HR manager without overpaying","How to hire your first HR manager — HR & PEOPLE | TBC","Struggling with hire your first hr manager wit? Learn how to overcome this challenge and scale your operations successfully. TBC, Greater Noida.",P3
guide,how-to-manage-subcontractors-without-losing-quality-control,"How to manage subcontractors without losing quality control","How to manage subcontractors — Expert Guide | TBC","It adds flexibility and capacity but introduces quality and delivery risk. Learn how to resolve this and scale effectively. TBC, Greater Noida.",P2
guide,how-to-calculate-and-improve-your-product-margins-accurately,"How to calculate and improve your product margins accurately","How to calculate and improve y — Expert Guide | TBC","This gives you the full absorption cost per unit. Learn how to resolve this and scale effectively. TBC, Greater Noida.",P5
guide,how-to-manage-supplier-price-increases-without-passing-them-all-to-your-customers,"How to manage supplier price increases without passing them all to your customers","How to manage supplier price — Expert Guide | TBC","Struggling with manage supplier price increase? Learn how to overcome this challenge and scale your operations successfully. TBC, Delhi NCR.",P1
guide,how-to-implement-a-vendor-scorecard-system,"How to implement a vendor scorecard system","How to implement a vendor scor — Expert Guide | TBC","Define four to six KPIs per vendor category. Learn how to master implement a vendor scorecard system to drive growth. TBC, NCR.",P1
guide,how-to-calculate-the-true-cost-of-holding-inventory,"How to calculate the true cost of holding inventory","How to calculate the true cost — Expert Guide | TBC","Add these up for your specific situation. Learn how to master calculate the true cost of holding inventory to drive growth. TBC, Delhi NCR.",P1
guide,how-to-use-government-export-incentives-and-schemes-effectively,"How to use government export incentives and schemes effectively","How to use government export — EXPORT & INTERNATIONAL | TBC","The savings are real and worth the effort. Learn how to resolve this and scale effectively. TBC, NCR.",P2
guide,how-to-package-your-product-for-international-markets,"How to package your product for international markets","How to package your product fo — Expert Guide | TBC","Struggling with package your product for inter? Learn how to overcome this challenge and scale your operations successfully. TBC, Greater Noida.",P2
guide,how-to-build-a-spend-analysis-and-find-where-your-money-is-really-going,"How to build a spend analysis and find where your money is really going","How to build a spend analysis and — BUSINESS STRATEGY | TBC","A spend analysis is the starting point for any serious procurement improvement. Learn how to resolve this and scale effectively. TBC, Greater Noida.",P2
guide,how-to-handle-a-critical-supplier-who-is-delivering-late-consistently,"How to handle a critical supplier who is delivering late consistently","How to handle a critical suppl — Expert Guide | TBC","The question is not whether to address it but how to address it effectively. Learn how to resolve this and scale effectively. TBC, Greater Noida.",P1
guide,how-to-prepare-for-a-customer-quality-audit,"How to prepare for a customer quality audit","How to prepare for a customer — Expert Guide | TBC","Struggling with prepare for a customer quality? Learn how to overcome this challenge and scale your operations successfully. TBC, NCR.",P2
guide,how-to-reduce-the-cost-of-quality-in-your-business,"How to reduce the cost of quality in your business","How to reduce the cost of qual — Expert Guide | TBC","Calculate your current cost of quality. Learn how to master reduce the cost of quality in your business to drive growth. TBC, Delhi NCR.",P2
guide,how-to-manage-calibration-of-measuring-instruments-in-your-plant,"How to manage calibration of measuring instruments in your plant","How to manage calibration of — BUSINESS STRATEGY | TBC","Every quality audit and customer quality requirement will check calibration. Learn how to resolve this and scale effectively. TBC, Delhi NCR.",P2
guide,how-to-manage-last-mile-delivery-for-b2b-customers,"How to manage last-mile delivery for B2B customers","How to manage last-mile delivery — BUSINESS STRATEGY | TBC","Delivery windows matter more than speed for most B2B customers. Learn how to master manage last-mile delivery for b2b customers to drive growth. TBC, NCR.",P6
guide,how-to-build-a-reverse-logistics-process-for-returns-and-replacements,"How to build a reverse logistics process for returns and replacements","How to build a reverse logisti — Expert Guide | TBC","If 30% are 'customer overstock,' that's a demand planning or sales forecasting problem. Learn how to resolve this and scale effectively. TBC, NCR.",P1
guide,how-to-set-up-a-distributor-incentive-programme-that-actually-drives-sales,"How to set up a distributor incentive programme that actually drives sales","How to set up a distributor — Expert Guide | TBC","Struggling with set up a distributor incentive? Learn how to overcome this challenge and scale your operations successfully. TBC, Greater Noida.",P1
guide,how-to-manage-water-and-waste-costs-in-a-manufacturing-facility,"How to manage water and waste costs in a manufacturing facility","How to manage water and waste — Expert Guide | TBC","Cooling water recirculation is often the highest-impact water reduction measure. Learn how to resolve this and scale effectively. TBC, Delhi NCR.",P5
guide,how-to-manage-spare-parts-inventory-for-your-production-equipment,"How to manage spare parts inventory for your production equipment","How to manage spare parts inve — Expert Guide | TBC","Classify your spares by criticality and failure frequency. Learn how to resolve this and scale effectively. TBC, Greater Noida.",P2
guide,how-to-implement-quality-control-without-a-dedicated-qc-department,"How to implement quality control without a dedicated QC department","How to implement quality contr — Expert Guide | TBC","You need data to find where quality problems are concentrated. Learn how to resolve this and scale effectively. TBC, Greater Noida.",P2
guide,how-to-set-up-a-production-planning-system-that-reduces-chaos,"How to set up a production planning system that reduces chaos","How to set up a production pla — Expert Guide | TBC","When that person is absent, the plant runs reactively. Learn how to resolve this and scale effectively. TBC, NCR.",P2
guide,how-to-reduce-raw-material-waste-in-your-production-process,"How to reduce raw material waste in your production process","How to reduce raw material was — Expert Guide | TBC","Struggling with reduce raw material waste in y? Learn how to overcome this challenge and scale your operations successfully. TBC, Delhi NCR.",P2
guide,how-to-manage-a-factory-shift-system-without-productivity-dropping-on-night-shifts,"How to manage a factory shift system without productivity dropping on night shifts","How to manage a factory shift — Expert Guide | TBC","Fix the structure and the productivity gap closes. Learn how to resolve this and scale effectively. TBC, Greater Noida.",P2
guide,how-to-build-a-supply-chain-that-doesn-t-collapse-when-one-supplier-fails,"How to build a supply chain that doesn't collapse when one supplier fails","How to build a supply chain th — Expert Guide | TBC","Pay on time, give them reasonable forecast visibility, and communicate problems early. Learn how to resolve this and scale effectively. TBC, Greater Noida.",P1
guide,how-to-negotiate-better-terms-with-your-raw-material-suppliers,"How to negotiate better terms with your raw material suppliers","How to negotiate better terms — Expert Guide | TBC","You can often get better total value by negotiating terms rather than price. Learn how to resolve this and scale effectively. TBC, Greater Noida.",P1
