type,slug,original_title,title_tag,meta_description,pillar
guide,how-to-reduce-lead-times-from-your-suppliers,"How to reduce lead times from your suppliers","How to reduce lead times from — Expert Guide | TBC","Struggling with reduce lead times from your su? Learn how to overcome this challenge and scale your operations successfully. TBC, NCR.",P1
guide,how-to-manage-import-logistics-without-a-dedicated-team,"How to manage import logistics without a dedicated team","How to manage import logistics — Expert Guide | TBC","Struggling with manage import logistics withou? Learn how to overcome this challenge and scale your operations successfully. TBC, Delhi NCR.",P1
guide,how-to-choose-between-making-a-component-in-house-versus-buying-it,"How to choose between making a component in-house versus buying it","How to choose between making a — BUSINESS STRATEGY | TBC","These overhead costs are real but often invisible in a make-vs-buy analysis. Learn how to resolve this and scale effectively. TBC, NCR.",P7
guide,how-to-start-exporting-from-india-without-a-dedicated-export-team,"How to start exporting from India without a dedicated export team","How to start exporting from In — Expert Guide | TBC","You also need your company's GST registration. Learn how to resolve this and scale effectively. TBC, NCR.",P3
guide,how-to-find-genuine-international-buyers-for-your-products,"How to find genuine international buyers for your products","How to find genuine internatio — Expert Guide | TBC","FIEO and EPC (Export Promotion Councils) often subsidise Indian SME participation. Learn how to resolve this and scale effectively. TBC, Delhi NCR.",P2
guide,how-to-price-your-product-for-export-without-undervaluing-it,"How to price your product for export without undervaluing it","How to price your product for — EXPORT & INTERNATIONAL | TBC","Samples and R&D costs are often absorbed by Indian exporters without recovery. Learn how to resolve this and scale effectively. TBC, Greater Noida.",P7
guide,how-to-manage-export-payment-risk-and-get-paid-reliably,"How to manage export payment risk and get paid reliably","How to manage export payment r — Expert Guide | TBC","Struggling with manage export payment risk and? Learn how to overcome this challenge and scale your operations successfully. TBC, NCR.",P1
guide,how-to-get-your-products-certified-for-international-markets,"How to get your products certified for international markets","How to get your products certi — Expert Guide | TBC","Start with the destination market and product category. Learn how to resolve this and scale effectively. TBC, Greater Noida.",P2
guide,how-to-set-up-a-purchase-order-system-that-prevents-maverick-spending,"How to set up a purchase order system that prevents maverick spending","How to set up a purchase order — Expert Guide | TBC","The solution is a process that's controlled without being slow. Learn how to resolve this and scale effectively. TBC, NCR.",P1
guide,how-to-evaluate-and-onboard-new-suppliers-systematically,"How to evaluate and onboard new suppliers systematically","How to evaluate and onboard ne — Expert Guide | TBC","This works sometimes and fails expensively at others. Learn how to master evaluate and onboard new suppliers systematically to drive growth. TBC, NCR.",P1
guide,how-to-manage-procurement-for-a-project-based-business,"How to manage procurement for a project-based business","How to manage procurement for — Expert Guide | TBC","Struggling with manage procurement for a proje? Learn how to overcome this challenge and scale your operations successfully. TBC, Greater Noida.",P1
guide,how-to-get-iso-9001-certified-without-disrupting-your-operations,"How to get ISO 9001 certified without disrupting your operations","How to get ISO 9001 certified — Expert Guide | TBC","Struggling with get iso 9001 certified without? Learn how to overcome this challenge and scale your operations successfully. TBC, Greater Noida.",P2
guide,how-to-handle-a-major-customer-complaint-without-losing-the-relationship,"How to handle a major customer complaint without losing the relationship","How to handle a major customer — BUSINESS STRATEGY | TBC","If it's a service failure, understand what's currently affected. Learn how to resolve this and scale effectively. TBC, Greater Noida.",P1
guide,how-to-build-a-culture-of-quality-in-a-production-team,"How to build a culture of quality in a production team","How to build a culture of qual — Expert Guide | TBC","Struggling with build a culture of quality in ? Learn how to overcome this challenge and scale your operations successfully. TBC, Delhi NCR.",P2
guide,how-to-reduce-dead-stock-without-damaging-supplier-relationships,"How to reduce dead stock without damaging supplier relationships","How to reduce dead stock witho — Expert Guide | TBC","It ties up working capital, occupies warehouse space, and often deteriorates in value. Learn how to resolve this and scale effectively. TBC, Delhi NCR.",P1
guide,how-to-set-the-right-reorder-points-for-your-key-materials,"How to set the right reorder points for your key materials","How to set the right reorder p — Expert Guide | TBC","A reorder point (ROP) is the inventory level at which you place a new order. Learn how to resolve this and scale effectively. TBC, Greater Noida.",P2
guide,how-to-conduct-a-physical-stock-audit-without-shutting-down-operations,"How to conduct a physical stock audit without shutting down operations","How to conduct a physical stoc — Expert Guide | TBC","By then, the discrepancy has been accumulating for 12 months and is difficult to trace. Learn how to resolve this and scale effectively. TBC, Delhi NCR.",P2
guide,how-to-manage-seasonal-inventory-without-tying-up-all-your-cash,"How to manage seasonal inventory without tying up all your cash","How to manage seasonal invento — Expert Guide | TBC","Working capital financing for inventory build is legitimate and often underused. Learn how to resolve this and scale effectively. TBC, NCR.",P1
guide,how-to-implement-a-warehouse-management-system-on-a-limited-budget,"How to implement a warehouse management system on a limited budget","How to implement a warehouse — Expert Guide | TBC","For most Indian SMEs, the problem isn't the software — it's the process discipline. Learn how to resolve this and scale effectively. TBC, NCR.",P1
guide,how-to-forecast-demand-more-accurately-for-production-planning,"How to forecast demand more accurately for production planning","How to forecast demand more — Expert Guide | TBC","Struggling with forecast demand more accuratel? Learn how to overcome this challenge and scale your operations successfully. TBC, Greater Noida.",P2
guide,how-to-reduce-your-freight-costs-without-switching-logistics-partners,"How to reduce your freight costs without switching logistics partners","How to reduce your freight cos — Expert Guide | TBC","There is almost always 10–20% reduction available without changing your logistics partner. Learn how to resolve this and scale effectively. TBC, NCR.",P1
guide,how-to-set-up-a-distribution-network-for-a-new-product,"How to set up a distribution network for a new product","How to set up a distribution — Expert Guide | TBC","Struggling with set up a distribution network ? Learn how to overcome this challenge and scale your operations successfully. TBC, NCR.",P1
guide,how-to-manage-a-third-party-logistics-3pl-provider-effectively,"How to manage a third-party logistics (3PL) provider effectively","How to manage a third-party — Expert Guide | TBC","System integration is often painful but pays back within months. Learn how to resolve this and scale effectively. TBC, NCR.",P1
guide,how-to-reduce-electricity-costs-in-a-manufacturing-plant,"How to reduce electricity costs in a manufacturing plant","How to reduce electricity cost — Expert Guide | TBC","Struggling with reduce electricity costs in a ? Learn how to overcome this challenge and scale your operations successfully. TBC, Delhi NCR.",P2
guide,how-to-evaluate-whether-solar-power-makes-financial-sense-for-your-factory,"How to evaluate whether solar power makes financial sense for your factory","How to evaluate whether solar — Expert Guide | TBC","What would your solar generation cost (currently ₹3–4. Learn how to resolve this and scale effectively. TBC, Greater Noida.",P2
guide,how-to-set-up-a-new-office-space-that-your-team-will-actually-want-to-work-in,"How to set up a new office space that your team will actually want to work in","How to set up a new office spa — Expert Guide | TBC","Before you design anything, understand how your team actually works. Learn how to resolve this and scale effectively. TBC, NCR.",P3
guide,how-to-decide-between-buying-and-leasing-commercial-property-for-your-business,"How to decide between buying and leasing commercial property for your business","How to decide between buying a — Expert Guide | TBC","This requires proper legal structuring; consult a CA and lawyer before implementing. Learn how to resolve this and scale effectively. TBC, Delhi NCR.",P2
guide,how-to-manage-multiple-office-locations-without-losing-operational-cohesion,"How to manage multiple office locations without losing operational cohesion","How to manage multiple office — Expert Guide | TBC","Struggling with manage multiple office locatio? Learn how to overcome this challenge and scale your operations successfully. TBC, Greater Noida.",P2
guide,how-to-evaluate-whether-your-business-needs-a-registered-office-versus-a-virtual-office,"How to evaluate whether your business needs a registered office versus a virtual office","How to evaluate whether your — Expert Guide | TBC","The operational office where your team works is a separate decision. Learn how to resolve this and scale effectively. TBC, NCR.",P2
guide,how-to-manage-office-maintenance-without-a-dedicated-facilities-team,"How to manage office maintenance without a dedicated facilities team","How to manage office maintenance — FACILITY MANAGEMENT | TBC","For companies under 200 people, a dedicated facilities team is usually not justified. Learn how to resolve this and scale effectively. TBC, Greater Noida.",P1
guide,how-to-manage-security-for-your-office-or-facility,"How to manage security for your office or facility","How to manage security for your — FACILITY MANAGEMENT | TBC","Know who is in your building at all times. Learn how to master manage security for your office or facility to drive growth. TBC, Delhi NCR.",P4
guide,how-to-manage-your-office-lease-renewal-without-being-held-hostage-by-the-landlord,"How to manage your office lease renewal without being held hostage by the landlord","How to manage your office lease — FACILITY MANAGEMENT | TBC","The landlord knows this and will price it in. Learn how to resolve this and scale effectively. TBC, Greater Noida.",P4
guide,how-to-handle-a-workplace-safety-incident-correctly,"How to handle a workplace safety incident correctly","How to handle a workplace safety — FACILITY MANAGEMENT | TBC","Struggling with handle a workplace safety inci? Learn how to overcome this challenge and scale your operations successfully. TBC, Delhi NCR.",P4
guide,how-to-set-up-a-disaster-recovery-plan-for-your-office-or-facility,"How to set up a disaster recovery plan for your office or facility","How to set up a disaster recov — Expert Guide | TBC","Struggling with set up a disaster recovery pla? Learn how to overcome this challenge and scale your operations successfully. TBC, Greater Noida.",P4
guide,how-to-prepare-your-company-for-a-bank-loan-application,"How to prepare your company for a bank loan application","How to prepare your company for a — BUSINESS LOANS | TBC","Struggling with prepare your company for a ban? Learn how to overcome this challenge and scale your operations successfully. TBC, Greater Noida.",P2
guide,how-to-choose-between-a-term-loan-overdraft-and-cash-credit-facility,"How to choose between a term loan, overdraft, and cash credit facility","How to choose between a term loan, — BUSINESS LOANS | TBC","Struggling with choose between a term loan, ov? Learn how to overcome this challenge and scale your operations successfully. TBC, Greater Noida.",P7
guide,how-to-approach-an-nbfc-when-your-bank-has-said-no,"How to approach an NBFC when your bank has said no","How to approach an NBFC when your — BUSINESS LOANS | TBC","Struggling with approach an nbfc when your ban? Learn how to overcome this challenge and scale your operations successfully. TBC, Greater Noida.",P1
guide,how-to-use-your-msme-registration-to-access-better-financing,"How to use your MSME registration to access better financing","How to use your MSME registration — BUSINESS LOANS | TBC","Struggling with use your msme registration to ? Learn how to overcome this challenge and scale your operations successfully. TBC, Delhi NCR.",P5
guide,how-to-get-a-business-loan-when-you-have-limited-collateral,"How to get a business loan when you have limited collateral","How to get a business loan when you — BUSINESS LOANS | TBC","Cash flow-based lending is increasingly available. Learn how to resolve this and scale effectively. TBC, Greater Noida.",P7
guide,how-to-build-a-13-week-cash-flow-forecast-that-keeps-you-ahead-of-cash-problems,"How to build a 13-week cash flow forecast that keeps you ahead of cash problems","How to build a 13-week cash fl — Expert Guide | TBC","A 13-week cash flow forecast is the most practical financial tool for managing business cash. Learn how to resolve this and scale effectively. TBC, NCR.",P4
guide,how-to-reduce-your-debtors-days-outstanding,"How to reduce your debtors days outstanding","How to reduce your debtors day — Expert Guide | TBC","Struggling with reduce your debtors days outst? Learn how to overcome this challenge and scale your operations successfully. TBC, NCR.",P4
guide,how-to-extend-your-payables-without-damaging-supplier-relationships,"How to extend your payables without damaging supplier relationships","How to extend your payables wi — Expert Guide | TBC","Struggling with extend your payables without d? Learn how to overcome this challenge and scale your operations successfully. TBC, Delhi NCR.",P4
guide,how-to-manage-your-working-capital-cycle-in-a-seasonal-business,"How to manage your working capital cycle in a seasonal business","How to manage your working cap — Expert Guide | TBC","Map your working capital cycle accurately. Learn how to resolve this and scale effectively. TBC, NCR.",P4
guide,how-to-evaluate-and-use-invoice-discounting-to-solve-cash-flow-problems,"How to evaluate and use invoice discounting to solve cash flow problems","How to evaluate and use invoic — Expert Guide | TBC","They advance 70–85% of the invoice value immediately. Learn how to resolve this and scale effectively. TBC, Greater Noida.",P4
guide,how-to-build-a-working-capital-policy-for-your-business,"How to build a working capital policy for your business","How to build a working capital — Expert Guide | TBC","Struggling with build a working capital policy? Learn how to overcome this challenge and scale your operations successfully. TBC, NCR.",P4
guide,how-to-negotiate-better-payment-terms-with-your-customers,"How to negotiate better payment terms with your customers","How to negotiate better paymen — Expert Guide | TBC","Struggling with negotiate better payment terms? Learn how to overcome this challenge and scale your operations successfully. TBC, Delhi NCR.",P4
guide,how-to-manage-petty-cash-and-small-expenses-without-losing-control,"How to manage petty cash and small expenses without losing control","How to manage petty cash and s — Expert Guide | TBC","Office stationery, small refreshments, courier charges, and emergency small purchases. Learn how to resolve this and scale effectively. TBC, Delhi NCR.",P4
guide,how-to-improve-your-company-s-credit-rating-and-borrowing-terms-over-time,"How to improve your company's credit rating and borrowing terms over time","How to improve your company's — Expert Guide | TBC","Understand what determines your credit profile. Learn how to resolve this and scale effectively. TBC, Greater Noida.",P4
guide,how-to-use-a-line-of-credit-effectively-without-paying-interest-unnecessarily,"How to use a line of credit effectively without paying interest unnecessarily","How to use a line of credit — Expert Guide | TBC","Struggling with use a line of credit effective? Learn how to overcome this challenge and scale your operations successfully. TBC, NCR.",P4
guide,how-to-manage-a-commercial-property-dispute-with-your-landlord,"How to manage a commercial property dispute with your landlord","How to manage a commercial pro — Expert Guide | TBC","Before any dispute escalates, read your leave and license agreement carefully. Learn how to resolve this and scale effectively. TBC, Greater Noida.",P7
guide,how-to-plan-a-factory-or-warehouse-expansion-without-disrupting-current-operations,"How to plan a factory or warehouse expansion without disrupting current operations","How to plan a factory or wareh — Expert Guide | TBC","Done poorly, the expansion itself becomes the source of delivery problems. Learn how to resolve this and scale effectively. TBC, Delhi NCR.",P2
guide,how-to-evaluate-and-set-up-a-second-production-location,"How to evaluate and set up a second production location","How to evaluate and set up a s — Expert Guide | TBC","Plan for the first 12 months to be inefficient. Learn how to master evaluate and set up a second production location to drive growth. TBC, Greater Noida.",P2
guide,how-to-restructure-your-business-debt-when-it-becomes-unmanageable,"How to restructure your business debt when it becomes unmanageable","How to restructure your business — BUSINESS LOANS | TBC","Struggling with restructure your business debt? Learn how to overcome this challenge and scale your operations successfully. TBC, NCR.",P3
guide,how-to-use-equipment-financing-to-upgrade-your-production-capability,"How to use equipment financing to upgrade your production capability","How to use equipment financing to — BUSINESS LOANS | TBC","Equipment financing works by using the asset being purchased as the primary collateral. Learn how to resolve this and scale effectively. TBC, Delhi NCR.",P5
guide,how-to-manage-working-capital-in-a-trading-or-distribution-business,"How to manage working capital in a trading or distribution business","How to manage working capital — Expert Guide | TBC","Customer credit risk is a constant challenge in distribution. Learn how to resolve this and scale effectively. TBC, NCR.",P4
guide,how-to-evaluate-whether-to-offer-credit-to-your-customers,"How to evaluate whether to offer credit to your customers","How to evaluate whether to off — Expert Guide | TBC","Start with the strategic question: does credit drive incremental revenue or just shift timing? Learn how to resolve this and scale effectively. TBC, NCR.",P4
guide,how-to-recover-a-bad-debt-without-going-to-court,"How to recover a bad debt without going to court","How to recover a bad debt with — Expert Guide | TBC","Struggling with recover a bad debt without goi? Learn how to overcome this challenge and scale your operations successfully. TBC, Greater Noida.",P4
guide,how-to-manage-an-office-renovation-without-losing-productivity,"How to manage an office renovation without losing productivity","How to manage an office renova — Expert Guide | TBC","Phase the renovation to keep a productive work area available throughout. Learn how to resolve this and scale effectively. TBC, Greater Noida.",P4
guide,how-to-manage-parking-and-commute-challenges-as-your-team-grows,"How to manage parking and commute challenges as your team grows","How to manage parking and comm — Expert Guide | TBC","Ignoring them is a slow attrition driver. Learn how to resolve this and scale effectively. TBC, Greater Noida.",P3
guide,how-to-set-up-a-professional-client-facing-meeting-space-on-a-budget,"How to set up a professional client-facing meeting space on a budget","How to set up a professional — OFFICE SETUP & FACILITY | TBC","Your meeting room is the first physical impression your clients get of your company. Learn how to resolve this and scale effectively. TBC, NCR.",P7
guide,how-to-set-up-a-remote-work-policy-that-actually-works,"How to set up a remote work policy that actually works","How to set up a remote work po — Expert Guide | TBC","Struggling with set up a remote work policy th? Learn how to overcome this challenge and scale your operations successfully. TBC, NCR.",P7
guide,how-to-set-up-an-ergonomic-workspace-to-reduce-sick-days-and-improve-productivity,"How to set up an ergonomic workspace to reduce sick days and improve productivity","How to set up an ergonomic — OFFICE SETUP & FACILITY | TBC","The chair is the most important investment. Learn how to resolve this and scale effectively. TBC, Delhi NCR.",P7
guide,how-to-manage-working-capital-during-a-period-of-rapid-growth,"How to manage working capital during a period of rapid growth","How to manage working capital — Expert Guide | TBC","Struggling with manage working capital during ? Learn how to overcome this challenge and scale your operations successfully. TBC, Greater Noida.",P4
guide,how-to-build-an-expense-management-system-that-doesn-t-slow-down-your-team,"How to build an expense management system that doesn't slow down your team","How to build an expense manage — Expert Guide | TBC","A well-designed system resolves all three. Learn how to resolve this and scale effectively. TBC, Greater Noida.",P3
guide,how-to-negotiate-with-internet-service-providers-for-better-business-broadband,"How to negotiate with internet service providers for better business broadband","How to negotiate with internet — Expert Guide | TBC","Bandwidth requirement depends on your team size and work type. Learn how to resolve this and scale effectively. TBC, NCR.",P7
guide,how-to-set-up-a-server-room-or-it-closet-safely-and-correctly,"How to set up a server room or IT closet safely and correctly","How to set up a server room or — Expert Guide | TBC","UPS (Uninterruptible Power Supply): every server and network equipment needs UPS backup. Learn how to resolve this and scale effectively. TBC, NCR.",P7
guide,how-to-manage-office-stationery-and-consumables-procurement-cost-effectively,"How to manage office stationery and consumables procurement cost-effectively","How to manage office stationer — Expert Guide | TBC","For companies printing above 10,000 pages per month, MPS often reduces total printing costs. Learn how to resolve this and scale effectively. TBC, NCR.",P5
guide,how-to-implement-an-access-control-and-employee-identity-system-as-you-scale,"How to implement an access control and employee identity system as you scale","How to implement an access con — Expert Guide | TBC","Systems that log entry and exit provide both security and attendance tracking. Learn how to resolve this and scale effectively. TBC, Delhi NCR.",P7
guide,how-to-plan-and-manage-your-company-s-annual-maintenance-budget,"How to plan and manage your company's annual maintenance budget","How to plan and manage your — OFFICE SETUP & FACILITY | TBC","For each, note: purchase date, expected useful life, last serviced, and next service due. Learn how to resolve this and scale effectively. TBC, Delhi NCR.",P1
guide,how-to-set-up-a-proper-treasury-function-for-a-mid-sized-company,"How to set up a proper treasury function for a mid-sized company","How to set up a proper treasur — Expert Guide | TBC","At ₹20Cr+ revenue, a structured approach to treasury pays for itself. Learn how to resolve this and scale effectively. TBC, Delhi NCR.",P5
guide,how-to-manage-company-vehicles-and-transport-costs-effectively,"How to manage company vehicles and transport costs effectively","How to manage company vehicles — Expert Guide | TBC","What percentage of the time are your vehicles being used for business purposes? Learn how to resolve this and scale effectively. TBC, NCR.",P5
guide,how-to-evaluate-whether-to-move-to-a-larger-office-space-or-optimise-the-current-one,"How to evaluate whether to move to a larger office space or optimise the current one","How to evaluate whether to mov — Expert Guide | TBC","Meeting room utilisation is the most common space problem. Learn how to resolve this and scale effectively. TBC, NCR.",P5
guide,how-to-manage-office-cleaning-and-hygiene-to-a-professional-standard-without-a-large-facilities-budget,"How to manage office cleaning and hygiene to a professional standard without a large facilities budget","How to manage office cleaning — Expert Guide | TBC","The cleaning contractor is your most important facilities vendor. Learn how to resolve this and scale effectively. TBC, Delhi NCR.",P5
guide,how-to-build-an-office-culture-that-makes-people-want-to-come-in,"How to build an office culture that makes people want to come in","How to build an office culture — Expert Guide | TBC","Individual focus work is often better done at home. Learn how to resolve this and scale effectively. TBC, Delhi NCR.",P3
guide,how-to-write-content-that-ranks-on-google-and-converts-readers-into-leads,"How to write content that ranks on Google and converts readers into leads","How to write content that rank — Expert Guide | TBC","There's a difference between content that ranks and content that converts. Learn how to resolve this and scale effectively. TBC, NCR.",P6
guide,how-to-use-google-ads-to-generate-b2b-leads-without-wasting-your-budget,"How to use Google Ads to generate B2B leads without wasting your budget","How to use Google Ads to gener — Expert Guide | TBC","Struggling with use google ads to generate b2b? Learn how to overcome this challenge and scale your operations successfully. TBC, Delhi NCR.",P6
