type,slug,original_title,title_tag,meta_description,pillar
blog,a-clients-journey-with-tbc-from-chaos-to-execution-clarity,"A Client's Journey with TBC: From Chaos to Execution Clarity","A Client's Journey with TBC: From — Technology | TBC","Growth can be both an opportunity and a challenge for businesses. Learn how to master from chaos to execution clarity to drive growth. TBC, Greater Noida.",P7
blog,automating-manual-reporting-saving-10-hours-a-week,"Automating Manual Reporting: Saving 10 Hours a Week","Automating Manual Reporting — Saving 10 Hours a Week | TBC","These processes often consume 10-15 hours of employee time every week. Learn how to master saving 10 hours a week to drive growth. TBC, Greater Noida.",P7
blog,boosting-business-with-it-solutions,"Boosting Business with IT Solutions","Boosting Business with IT Solutions — Technology | TBC","Struggling with boosting business with it solu? Learn how to overcome this challenge and scale your operations successfully. TBC, Greater Noida.",P7
blog,bridging-the-gap-between-it-and-operations,"Bridging the Gap Between IT and Operations","Bridging the Gap Between — IT and Operations | TBC","Struggling with bridging the gap between it an? Learn how to overcome this challenge and scale your operations successfully. TBC, NCR.",P2
blog,building-a-second-layer-of-leadership-from-founder-to-ceo,"Building a Second Layer of Leadership: From Founder to CEO","Building a Leadership Layer — From Founder to CEO | TBC","Founder-led decisions become a massive bottleneck as you grow. Learn how to build an independent second layer of leadership to restore agility. TBC, NCR.",P4
blog,case-study-turning-chaos-into-clarity-for-a-founder-led-services,"Case Study: Turning Chaos Into Clarity for a Founder-Led Services","Case Study: Turning Chaos Into — Technology | TBC","What we found wasn't a people problem. Learn how to resolve this and scale effectively. TBC, Greater Noida.",P4
blog,choosing-the-right-crm-a-technical-consultants-perspective,"Choosing the Right CRM: A Technical Consultant's Perspective","Choosing the Right CRM: A Technical — Technology | TBC","Struggling with a technical consultant's persp? Learn how to overcome this challenge and scale your operations successfully. TBC, NCR.",P7
blog,eliminating-data-silos-in-mid-sized-firms,"Eliminating Data Silos in Mid-Sized Firms","Eliminating Data Silos — in Mid-Sized Firms | TBC","Struggling with eliminating data silos in mid-? Learn how to overcome this challenge and scale your operations successfully. TBC, Delhi NCR.",P7
blog,from-20-to-100-employees-surviving-the-complexity-wall,"From 20 to 100 Employees: Surviving the Complexity Wall","Scaling to 100 Employees — Avoiding the Complexity Wall | TBC","Most businesses hit a structure crisis at 40 employees. Learn why relational management breaks down and how to build scalable systems. TBC, NCR.",P7
blog,identifying-business-leakage-where-youre-losing-profit,"Identifying Business Leakage: Where You're Losing Profit","Business Profit Leakage — Where Indian Founders Lose Money | TBC","Profit leakage rarely shows up as a massive loss on your P&L. Learn how to identify and eliminate the silent inefficiencies draining your cash. TBC, NCR.",P5
blog,kpis-that-actually-matter-and-the-ones-that-dont,"KPIs That Actually Matter (And the Ones That Don't)","Meaningful Business KPIs — Eliminating Metric Overload | TBC","Dashboards full of data often create noise instead of clarity. Learn how to eliminate metric overload and track KPIs that actually drive growth. TBC, NCR.",P2
blog,management-consulting-for-the-messy-middle-20100-employees,"Management Consulting for the ""Messy Middle"" (20-100 Employees)","Management Consulting for the — Technology | TBC","Growth is often celebrated as the ultimate goal of any business. Learn how to resolve this and scale effectively. TBC, NCR.",P4
blog,managing-change-how-to-pivot-without-breaking-your-team,"Managing Change: How to Pivot Without Breaking Your Team","Managing Organizational Change — Pivoting Without Breaking Teams | TBC","Strategic pivots often fail because they create uncertainty. Learn how to manage organizational change and communicate clearly with your team. TBC, NCR.",P3
blog,optimizing-your-revenue-funnel-with-better-technical-tracking,"Optimizing Your Revenue Funnel with Better Technical Tracking","Optimizing Your Revenue Funnel with — Technology | TBC","Struggling with optimizing your revenue funnel? Learn how to overcome this challenge and scale your operations successfully. TBC, Delhi NCR.",P5
blog,security-and-scalability-protecting-your-growing-firm,"Security and Scalability: Protecting Your Growing Firm","Security and Scalability: — Technology | TBC","Struggling with protecting your growing firm? Learn how to overcome this challenge and scale your operations successfully. TBC, Greater Noida.",P7
blog,strategic-planning-vs-day-to-day-survival,"Strategic Planning vs. Day-to-Day Survival","Strategic Planning vs. Day-to-Day — Strategy | TBC","Struggling with strategic planning vs. day-to-? Learn how to overcome this challenge and scale your operations successfully. TBC, Delhi NCR.",P2
blog,streamlining-communication-in-teams-of-50-professionals,"Streamlining Communication in Teams of 50+ Professionals","Streamlining Communication in Teams — Technology | TBC","Struggling with streamlining communication in ? Learn how to overcome this challenge and scale your operations successfully. TBC, Greater Noida.",P3
blog,technical-consulting-101-is-your-tech-stack-holding-you-back,"Technical Consulting 101: Is Your Tech Stack Holding You Back?","Technical Consulting 101: Is Your — Technology | TBC","Struggling with is your tech stack holding you? Learn how to overcome this challenge and scale your operations successfully. TBC, Greater Noida.",P7
blog,technical-debt-the-silent-killer-of-business-growth,"Technical Debt: The Silent Killer of Business Growth","Technical Debt — The Silent Killer of Business Growth | TBC","Struggling with the silent killer of business ? Learn how to overcome this challenge and scale your operations successfully. TBC, NCR.",P6
blog,the-1m-rounding-error-how-scaling-businesses-leak-profit,"The $1M Rounding Error: How Scaling Businesses Leak Profit","The $1M Rounding Error: How Scaling — Technology | TBC","Struggling with how scaling businesses leak pr? Learn how to overcome this challenge and scale your operations successfully. TBC, Greater Noida.",P5
blog,the-90-day-roadmap-achieving-rapid-execution-clarity,"The 90-Day Roadmap: Achieving Rapid Execution Clarity","The 90-Day Roadmap — Achieving Rapid Execution Clarity | TBC","Struggling with achieving rapid execution clar? Learn how to overcome this challenge and scale your operations successfully. TBC, Greater Noida.",P7
blog,the-architecture-of-culture-in-a-rapidly-growing-team,"The Architecture of Culture in a Rapidly Growing Team","The Architecture of Culture — a Rapidly Growing Team | TBC","In small teams, culture emerges naturally through the behavior of founders and early employees. Learn how to resolve this and scale effectively. TBC, NCR.",P3
blog,the-execution-gap-why-great-strategies-fail-in-implementation,"The Execution Gap: Why Great Strategies Fail in Implementation","The Execution Gap: Why Great — Strategy | TBC","Struggling with great strategies fail in imple? Learn how to overcome this challenge and scale your operations successfully. TBC, Greater Noida.",P1
blog,the-origin-of-turbo-bytes-consulting-why-efficiency-matters,"The Origin of Turbo Bytes Consulting: Why Efficiency Matters","The Origin of Turbo Bytes — Technology | TBC","This challenge is exactly what led to the creation of Turbo Bytes Consulting (TBC). Learn how to master efficiency matters to drive growth. TBC, NCR.",P2
blog,the-silent-killer-quantifying-decision-latency-in-the-c-suite,"The Silent Killer: Quantifying Decision Latency in the C-Suite","The Silent Killer: Quantifying — Technology | TBC","Struggling with quantifying decision latency i? Learn how to overcome this challenge and scale your operations successfully. TBC, Delhi NCR.",P7
blog,the-technical-diagnostic-a-5-point-check-for-50-employee-firms,"The Technical Diagnostic: A 5-Point Check for 50-Employee Firms","The Technical Diagnostic: A 5-Point — Technology | TBC","Struggling with a 5-point check for 50-employe? Learn how to overcome this challenge and scale your operations successfully. TBC, Delhi NCR.",P7
blog,the-turbo-bytes-manifesto-scaling-beyond-the-founder,"The Turbo Bytes Manifesto: Scaling Beyond the Founder","The Turbo Bytes Manifesto — Scaling Beyond the Founder | TBC","Growth is often celebrated as the ultimate sign of business success. Learn how to master scaling beyond the founder to drive growth. TBC, Delhi NCR.",P4
blog,value-based-pricing-stop-giving-away-your-margin,"Value-Based Pricing: Stop Giving Away Your Margin","Value-Based Pricing — Stop Giving Away Your Margin | TBC","Struggling with stop giving away your margin? Learn how to overcome this challenge and scale your operations successfully. TBC, Greater Noida.",P5
blog,what-does-tbc-actually-do-our-multi-disciplinary-approach,"What Does TBC Actually Do? Our Multi-Disciplinary Approach","What Does TBC Actually Do? Our — Technology | TBC","Struggling with what does tbc actually do? our? Learn how to overcome this challenge and scale your operations successfully. TBC, Greater Noida.",P7
blog,why-most-organizational-charts-are-broken,"Why Most Organizational Charts Are Broken","Why Most Organizational — Charts Are Broken | TBC","Organizational charts often become outdated quickly. Learn how to master most organizational charts are broken to drive growth. TBC, NCR.",P3
blog,why-off-the-shelf-software-often-fails-scaling-teams,"Why Off-the-Shelf Software Often Fails Scaling Teams","Why Off-the-Shelf Software Often — Fails Scaling Teams | TBC","Struggling with off-the-shelf software often f? Learn how to overcome this challenge and scale your operations successfully. TBC, NCR.",P1
blog,why-we-use-the-name-turbo-bytes-speed-meets-technology,"Why We Use the Name ""Turbo Bytes"": Speed Meets Technology","Why We Use the Name ""Turbo Bytes"": — Technology | TBC","Struggling with speed meets technology? Learn how to overcome this challenge and scale your operations successfully. TBC, NCR.",P7
blog,test-draft-1,"The Future of AI Consulting","The Future of AI Consulting — Technology Insights | TBC","Many businesses struggle with the future of ai consulting. Learn how to master the future of ai consulting to drive growth. TBC, Greater Noida.",P1
blog,the-hidden-cost-of-ai-readiness-why-your-data-strategy-comes-before-your-ai-strategy,"The Hidden Cost of AI Readiness: Why Your Data Strategy Comes Before Your AI Strategy","The Hidden Cost of AI Readiness: — Strategy | TBC","This is not a technology problem. Learn how to master your data strategy comes before your ai strategy to drive growth. TBC, Greater Noida.",P1
blog,agentic-ai-why-your-next-hire-might-not-be-human,"Agentic AI: Why Your Next Hire Might Not Be Human","Agentic AI — Why Your Next Hire Might Not Be Human | TBC","These systems don't wait for instructions. Learn how to master your next hire might not be human to drive growth. TBC, NCR.",P1
blog,what-is-an-ai-consultancy-and-why-you-need-one,"What Is an AI Consultancy — And Why Mid-Sized Businesses Need One Now","What Is an AI Consultancy — And Why — AI Strategy | TBC","The result is usually one of two failure modes. Learn how to resolve this and scale effectively. TBC, Greater Noida.",P1
blog,ai-transformation-roadmap-indian-businesses,"AI Transformation for Indian Businesses: A Practical Roadmap","AI Transformation for Indian — AI Transformation | TBC","Transformation starts with a structured diagnostic. Learn how to master a practical roadmap to drive growth. TBC, Delhi NCR.",P1
blog,how-to-choose-an-ai-agency,"How to Choose an AI Agency: Seven Questions That Separate Real From Hype","How to Choose an AI Agency: Seven — AI Strategy | TBC","Struggling with seven questions that separate ? Learn how to overcome this challenge and scale your operations successfully. TBC, Delhi NCR.",P1
blog,custom-llm-explained-company-knowledge-asset,"Custom LLMs Explained: Turning Your Company's Knowledge Into an Asset","Custom LLMs Explained: Turning Your — Custom LLM | TBC","Struggling with turning your company's knowled? Learn how to overcome this challenge and scale your operations successfully. TBC, NCR.",P1
blog,real-cost-of-waiting-on-ai,"The Real Cost of Waiting on AI (And Why the Window Is Closing)","The Real Cost of Waiting on AI (And — AI Strategy | TBC","The longer the delay, the wider the gap, and the harder and more expensive it becomes to close. Learn how to resolve this and scale effectively. TBC, NCR.",P1
blog,ai-for-operations-where-intelligence-moves-the-needle,"AI for Operations: Where Intelligence Actually Moves the Needle","AI for Operations: Where — Operations | TBC","Struggling with where intelligence actually mo? Learn how to overcome this challenge and scale your operations successfully. TBC, Delhi NCR.",P1
blog,why-founders-become-the-bottleneck-ai,"Why Founders Become the Bottleneck — and How AI Helps Them Step Out","Why Founders Become the Bottleneck — Leadership | TBC","Every one of these is a structural signal, not a personal failing. Learn how to resolve this and scale effectively. TBC, NCR.",P1
blog,on-premise-ai-data-sensitive-businesses,"On-Premise AI: Why Data-Sensitive Businesses Are Keeping AI In-House","On-Premise AI: Why Data-Sensitive — Custom LLM | TBC","Struggling with data-sensitive businesses are ? Learn how to overcome this challenge and scale your operations successfully. TBC, NCR.",P1
blog,ai-strategy-vs-ai-tools,"AI Strategy vs AI Tools: The Distinction That Determines Success","AI Strategy vs AI Tools: The — AI Strategy | TBC","But beneath the surface, something essential is missing. Learn how to master the distinction that determines success to drive growth. TBC, NCR.",P1
blog,50-employees-to-ai-native-transformation,"From 50 Employees to AI-Native: A Transformation Story","From 50 Employees to AI-Native: A — AI Transformation | TBC","None of these problems is catastrophic on its own. Learn how to master a transformation story to drive growth. TBC, Delhi NCR.",P1
blog,hidden-cost-manual-reporting-fix,"The Hidden Cost of Manual Reporting — And the Fix That Saves 10 Hours a Week","The Hidden Cost of Manual Reporting — Operations | TBC","The process seems mundane and therefore manageable. Learn how to resolve this and scale effectively. TBC, NCR.",P2
blog,delegation-problem-why-leaders-cant-delegate,"The Delegation Problem: Why Leaders Know They Should But Cannot","The Delegation Problem: Why Leaders — Leadership | TBC","These are genuine constraints, but they are not personal failings. Learn how to master leaders know they should but cannot to drive growth. TBC, Delhi NCR.",P4
blog,what-turbo-bytes-consulting-does-ai-native-management-consulting,"What Turbo Bytes Consulting Actually Does: AI-Native Management Consulting Explained","What Turbo Bytes Consulting — AI Strategy | TBC","Here is what that means in practice, and who it is actually for. Learn how to master ai-native management consulting explained to drive growth. TBC, NCR.",P1
blog,process-mapping-before-ai-automation,"Process Mapping Before AI: Why You Cannot Automate What You Have Not Understood","Process Mapping Before AI: Why You — Operations | TBC","The workarounds are usually not failures. Learn how to master you cannot automate what you have not understood to drive growth. TBC, Delhi NCR.",P1
blog,ai-capability-building-training-your-team,"AI Capability Building: Why Training Your Team Matters More Than the Tool","AI Capability Building: Why — AI | TBC","In reality, the tool was not the problem. Learn how to master training your team matters more than the tool to drive growth. TBC, Greater Noida.",P1
blog,information-gap-why-smart-leaders-make-slow-decisions,"The Information Gap: Why Smart Leaders Still Make Slow Decisions","The Information Gap: Why Smart — Strategy | TBC","This explanation is almost always wrong. Learn how to master smart leaders still make slow decisions to drive growth. TBC, Delhi NCR.",P4
blog,slate-ai-executive-assistant-senior-leader,"Slate: What an AI Executive Assistant Actually Does for a Senior Leader","Slate: What an AI Executive — AI | TBC","It is not wasted time — it is necessary. Learn how to resolve this and scale effectively. TBC, Greater Noida.",P1
blog,business-diagnostic-structured-assessment-reveals,"The Business Diagnostic: What a Structured Assessment Actually Reveals","The Business Diagnostic: What a — Consulting | TBC","Struggling with what a structured assessment a? Learn how to overcome this challenge and scale your operations successfully. TBC, Greater Noida.",P3
blog,culture-is-architecture-how-growing-teams-lose-it,"Culture Is Architecture: How Growing Teams Lose It and How to Keep It","Culture Is Architecture: How — Leadership | TBC","Struggling with how growing teams lose it and ? Learn how to overcome this challenge and scale your operations successfully. TBC, Greater Noida.",P3
blog,ai-readiness-assessment-is-your-business-ready,"The AI Readiness Assessment: Is Your Business Ready to Deploy Intelligence?","The AI Readiness Assessment: Is — AI Strategy | TBC","Struggling with is your business ready to depl? Learn how to overcome this challenge and scale your operations successfully. TBC, NCR.",P1
blog,ai-for-small-mid-sized-businesses-within-reach,"AI for Small and Mid-Sized Businesses: What Is Actually Within Reach","AI for Small and Mid-Sized — AI Strategy | TBC","Struggling with what is actually within reach? Learn how to overcome this challenge and scale your operations successfully. TBC, NCR.",P1
blog,when-to-fix-a-process-when-to-eliminate-it,"When to Fix a Process and When to Eliminate It","When to Fix a Process — and When to Eliminate It | TBC","Struggling with when to fix a process and when? Learn how to overcome this challenge and scale your operations successfully. TBC, NCR.",P2
blog,knowledge-management-age-of-ai,"Knowledge Management in the Age of AI: From Documents to Intelligence","Knowledge Management in the Age of — AI | TBC","Struggling with from documents to intelligence? Learn how to overcome this challenge and scale your operations successfully. TBC, NCR.",P1
blog,hiring-growing-business-mistakes-that-cost-most,"Hiring for a Growing Business: The Mistakes That Cost the Most","Hiring for a Growing Business: The — Leadership | TBC","Structural problems require structural solutions. Learn how to master the mistakes that cost the most to drive growth. TBC, Greater Noida.",P4
blog,ai-financial-services-india-deploy-now,"AI in Financial Services: What Firms in India Can Deploy Right Now","AI in Financial Services: What — AI | TBC","This is a more solvable problem than it appears. Learn how to master what firms in india can deploy right now to drive growth. TBC, Delhi NCR.",P1
blog,how-to-set-goals-organisation-actually-achieves,"How to Set Goals That Your Organisation Actually Achieves","How to Set Goals That Your — Strategy | TBC","What it frequently fails to generate is achievement. Learn how to resolve this and scale effectively. TBC, Greater Noida.",P3
blog,website-development-2026-ai-native-consultancy-builds-differently,"Website Development in 2026: What an AI-Native Consultancy Builds Differently","Website Development in 2026: What — AI | TBC","Struggling with what an ai-native consultancy ? Learn how to overcome this challenge and scale your operations successfully. TBC, NCR.",P1
blog,managing-underperformance-conversation-leaders-avoid,"Managing Underperformance: The Conversation Most Leaders Avoid","Managing Underperformance: The — Leadership | TBC","Despite all of this, the conversation gets delayed. Learn how to master the conversation most leaders avoid to drive growth. TBC, Greater Noida.",P4
blog,ai-social-media-content-creation-at-scale,"AI in Social Media: How Content Creation at Scale Actually Works","AI in Social Media: How Content — AI Strategy | TBC","Struggling with how content creation at scale ? Learn how to overcome this challenge and scale your operations successfully. TBC, NCR.",P1
blog,why-consulting-engagements-fail-to-deliver,"Why Most Consulting Engagements Fail to Deliver — And What Fixes It","Why Most Consulting Engagements — Consulting | TBC","The document is read once, referenced occasionally, and gradually overtaken by events. Learn how to resolve this and scale effectively. TBC, Delhi NCR.",P1
blog,ai-implementation-checklist-before-you-build,"The AI Implementation Checklist: What to Verify Before You Build Anything","The AI Implementation Checklist: — AI Strategy | TBC","Struggling with what to verify before you buil? Learn how to overcome this challenge and scale your operations successfully. TBC, Greater Noida.",P1
blog,org-chart-not-the-organisation-how-work-gets-done,"The Org Chart Is Not the Organisation: Understanding How Work Actually Gets Done","The Org Chart Is Not the — Operations | TBC","The formal structure defines authority. Learn how to master understanding how work actually gets done to drive growth. TBC, NCR.",P2
blog,generative-ai-vs-predictive-ai-business-decisions,"Generative AI vs Predictive AI: What the Difference Means for Business Decisions","Generative AI vs Predictive AI: — AI | TBC","Struggling with what the difference means for ? Learn how to overcome this challenge and scale your operations successfully. TBC, Greater Noida.",P1
blog,senior-hire-changes-everything-how-to-get-right,"The Senior Hire That Changes Everything — And How to Make It Right","The Senior Hire That Changes — Leadership | TBC","Senior hiring fails for a different set of reasons than mid-level hiring. Learn how to resolve this and scale effectively. TBC, Greater Noida.",P4
blog,ai-ethics-business-practical-questions-leaders,"AI Ethics for Business: The Practical Questions Leaders Need to Answer","AI Ethics for Business: The — AI | TBC","Struggling with the practical questions leader? Learn how to overcome this challenge and scale your operations successfully. TBC, Delhi NCR.",P1
blog,capacity-trap-businesses-stay-busy-without-growing,"The Capacity Trap: Why Businesses Stay Busy Without Growing","The Capacity Trap: Why Businesses — Operations | TBC","Struggling with businesses stay busy without g? Learn how to overcome this challenge and scale your operations successfully. TBC, Greater Noida.",P2
blog,ai-data-privacy-every-business-must-understand,"AI and Data Privacy: What Every Business Deploying AI Must Understand","AI and Data Privacy: What Every — AI | TBC","Struggling with what every business deploying ? Learn how to overcome this challenge and scale your operations successfully. TBC, NCR.",P1
blog,strategic-planning-mid-sized-businesses-framework,"Strategic Planning for Mid-Sized Businesses: A Framework That Actually Works","Strategic Planning for Mid-Sized — Strategy | TBC","Struggling with a framework that actually work? Learn how to overcome this challenge and scale your operations successfully. TBC, Greater Noida.",P2
blog,building-ai-first-culture-what-changes-what-stays,"Building an AI-First Culture: What Changes and What Stays the Same","Building an AI-First Culture: What — AI | TBC","Struggling with what changes and what stays th? Learn how to overcome this challenge and scale your operations successfully. TBC, Greater Noida.",P1
blog,standard-operating-procedure-actually-gets-followed,"The Standard Operating Procedure That Actually Gets Followed","The Standard Operating Procedure — Operations | TBC","The standard operating procedure has a credibility problem. Learn how to resolve this and scale effectively. TBC, Greater Noida.",P2
blog,ai-changes-economics-professional-services,"How AI Changes the Economics of Professional Services","How AI Changes — Economics of Professional Services | TBC","The disruption is not primarily about replacing professionals with machines. Learn how to resolve this and scale effectively. TBC, NCR.",P1
blog,first-90-days-new-leaders-should-and-should-not-do,"The First 90 Days: What New Leaders Should and Should Not Do","The First 90 Days: What New Leaders — Leadership | TBC","Struggling with what new leaders should and sh? Learn how to overcome this challenge and scale your operations successfully. TBC, Greater Noida.",P4
blog,llms-enterprise-what-they-can-cannot-do-what-goes-wrong,"LLMs in the Enterprise: What They Can Do, What They Cannot, and What Goes Wrong","LLMs in the Enterprise: What They — AI | TBC","The second common failure is inadequate context provision. Learn how to resolve this and scale effectively. TBC, Greater Noida.",P1
blog,scaling-without-breaking-grow-operations-without-losing-control,"Scaling Without Breaking: How to Grow Your Operations Without Losing Control","Scaling Without Breaking: How to — Operations | TBC","Struggling with grow your operations without l? Learn how to overcome this challenge and scale your operations successfully. TBC, NCR.",P2
blog,ai-customer-service-what-changes-intelligence-handles-inbox,"AI for Customer Service: What Changes When Intelligence Handles the Inbox","AI for Customer Service: What — AI | TBC","Struggling with what changes when intelligence? Learn how to overcome this challenge and scale your operations successfully. TBC, Greater Noida.",P1
blog,communicating-strategy-team-that-does-not-read-the-deck,"Communicating Strategy to a Team That Does Not Read the Deck","Communicating Strategy to a Team — Leadership | TBC","Struggling with communicating strategy to a te? Learn how to overcome this challenge and scale your operations successfully. TBC, Greater Noida.",P3
